Código,Tema,Subárea,Intergrantes
1000,Desenvolvimento de um sistema de gerenciamento de estoque para empresas de pequeno e médio porte,Sistemas de Informação,1111111111111,1111111111112,1111111111113,1111111111114
1101,Desenvolvimento de um sistema de detecção de fraudes em transações financeiras,Segurança em Sistemas,1111111111121,1111111111122,1111111111123,1111111111124
1202,Desenvolvimento de uma plataforma de e-commerce com integração a redes sociais,Desenvolvimento de Software,1111111111131,1111111111132,1111111111133,1111111111134
1203,Estudo comparativo de ferramentas de desenvolvimento de aplicativos móveis,Desenvolvimento de Software,1111111111141,1111111111142,1111111111143,1111111111144
1304,Desenvolvimento de um sistema de gestão de projetos para equipes remotas,Gerenciamento de Projetos,1111111111151,1111111111152,1111111111153,1111111111154
1205,Desenvolvimento de um chatbot para atendimento ao cliente em empresas de serviços,Desenvolvimento de Software,1111111111161,1111111111162,1111111111163,1111111111164
,,,,,,
